        Identifier                               : 0x03 (SFP)
        Extended identifier                      : 0x04 (GBIC/SFP defined by 2-wire interface ID)
        Connector                                : 0x07 (LC)
        Transceiver optical diagnostics:
        Module temperature                       : 33.42 degrees C / 92.16 degrees F
        Module voltage                           : 3.2914 V
        Laser bias current                       : 5.612 mA
        Laser output power                       : 0.6582 mW / -1.82 dBm
        Receiver signal average optical power    : 0.5821 mW / -2.35 dBm
